{
  "checks": [
    {
      "name": "local_package",
      "observed": "installed: version 1.2.0",
      "passed": true,
      "required": "local package imports with version"
    },
    {
      "name": "bundled_cli",
      "observed": "bundled: /home/user/TraceRazor/tracerazor/bin/tracerazor; binary=1.2.0",
      "passed": true,
      "required": "CLI binary is bundled or source-build reachable"
    },
    {
      "name": "schemas",
      "observed": "available: 19 schemas",
      "passed": true,
      "required": "all public contract schemas are shipped"
    },
    {
      "name": "artifact_card_verifies",
      "observed": "review_ready_smoke",
      "passed": true,
      "required": "artifact card verifies"
    },
    {
      "name": "reproduction_card_verifies",
      "observed": "reviewer_replay_ready_smoke",
      "passed": true,
      "required": "reproduction card verifies"
    },
    {
      "name": "contract_card_verifies",
      "observed": "library_contract_locked",
      "passed": true,
      "required": "public API/CLI/schema contract card verifies"
    },
    {
      "name": "install_card_verifies",
      "observed": "full_cli_install_ready",
      "passed": true,
      "required": "clean-wheel installability card verifies"
    },
    {
      "name": "release_docs_present",
      "observed": "8/8",
      "passed": true,
      "required": "README, trust matrix, release checklist, pyproject, contract card, and install card present"
    },
    {
      "name": "pypi",
      "observed": "mismatch: latest=1.1.0 local=1.2.0",
      "passed": false,
      "required": "PyPI latest version matches local version"
    },
    {
      "name": "piwheels",
      "observed": "unknown: <urlopen error Tunnel connection failed: 403 Forbidden>",
      "passed": false,
      "required": "piwheels exposes the local version file"
    },
    {
      "name": "crates_io",
      "observed": "missing: crate tracerazor is not published",
      "passed": false,
      "required": "crates.io package is published"
    },
    {
      "name": "github_tag",
      "observed": "pending: head=1cab6f971602 local_tag=False remote_tag=False",
      "passed": false,
      "required": "local version tag points at current commit locally and remotely"
    },
    {
      "name": "github_actions",
      "observed": "green: Agent Efficiency Gate=completed/success; Release=completed/success; TraceRazor CI=completed/success",
      "passed": true,
      "required": "required public workflows are green"
    },
    {
      "name": "openssf_scorecard",
      "observed": "unknown: <urlopen error Tunnel connection failed: 403 Forbidden>",
      "passed": false,
      "required": "OpenSSF Scorecard is published with score >= 7.0"
    },
    {
      "name": "provenance_plan_documented",
      "observed": "trusted publishing/OIDC",
      "passed": true,
      "required": "trusted publishing and OIDC documented"
    },
    {
      "name": "attestation_plan_documented",
      "observed": "GitHub artifact attestations",
      "passed": true,
      "required": "GitHub release artifact attestation documented"
    },
    {
      "name": "sbom_plan_documented",
      "observed": "CycloneDX/SHA-256",
      "passed": true,
      "required": "SBOM and checksum release assets documented"
    }
  ],
  "commands": [
    {
      "command": "python -m tracerazor.trice doctor --format json --timeout-s 10",
      "name": "doctor",
      "sha256": "ace403f07d9cdbbb8401ec8e982c252642c33cc7acae62c7ff7807f3db991b4f"
    },
    {
      "command": "python -m tracerazor.trice verify-contract docs/trice_contract_card.json",
      "name": "verify-contract",
      "sha256": "26a26a37b116960dfdca3bc9704e688eb6a5d1a1c82e3e69b84cbdb82010539c"
    },
    {
      "command": "python -m tracerazor.trice verify-reproduction docs/trice_reproduction_card.json",
      "name": "verify-reproduction",
      "sha256": "779e496fabdd046bfe476feaaf83f55207dbecf8196056668147cd9cd51a77e4"
    },
    {
      "command": "python -m tracerazor.trice verify-artifact docs/trice_artifact_card.json",
      "name": "verify-artifact",
      "sha256": "05946657b30c14d6d761ee3c61583728aa661dded680f2751db56ec9980d43c7"
    },
    {
      "command": "bash scripts/build_platform_wheel.sh",
      "name": "build",
      "sha256": "4fb22334b8220d961aee6d59f84f905ed5278d3eafa95b877f0dda35fbeaa9d2"
    },
    {
      "command": "python -m twine check dist/*.whl",
      "name": "twine-check",
      "sha256": "7c108d3474bdd41a615aba749433fe817b8915c4c20eae0b0998468cf619bd20"
    },
    {
      "command": "python -m pip_audit --progress-spinner off .",
      "name": "pip-audit",
      "sha256": "6f3d9cd7942d8fe624235804a19d35ae4dab5fffb847cfabee93798a1242965d"
    },
    {
      "command": "scorecard --repo=github.com/ZulfaqarHafez/TraceRazor",
      "name": "scorecard",
      "sha256": "ff4ddd6a008e6779932b065ce97cd0c68610b19da5db90a6f952581576f439e9"
    }
  ],
  "doctor_snapshot": {
    "checks": {
      "bundled_cli": {
        "detail": "/home/user/TraceRazor/tracerazor/bin/tracerazor; binary=1.2.0",
        "ok": true,
        "status": "bundled"
      },
      "crates_io": {
        "detail": "crate tracerazor is not published",
        "ok": false,
        "status": "missing",
        "url": "https://crates.io/api/v1/crates/tracerazor"
      },
      "github_actions": {
        "detail": "Agent Efficiency Gate=completed/success; Release=completed/success; TraceRazor CI=completed/success",
        "ok": true,
        "status": "green",
        "url": "https://api.github.com/repos/ZulfaqarHafez/tracerazor/actions/runs?per_page=30"
      },
      "github_tag": {
        "detail": "head=1cab6f971602 local_tag=False remote_tag=False",
        "ok": false,
        "status": "pending"
      },
      "local_package": {
        "detail": "version 1.2.0",
        "ok": true,
        "status": "installed"
      },
      "openssf_scorecard": {
        "detail": "<urlopen error Tunnel connection failed: 403 Forbidden>",
        "ok": null,
        "status": "unknown",
        "url": "https://api.scorecard.dev/projects/github.com/ZulfaqarHafez/TraceRazor"
      },
      "piwheels": {
        "detail": "<urlopen error Tunnel connection failed: 403 Forbidden>",
        "ok": null,
        "status": "unknown",
        "url": "https://www.piwheels.org/project/tracerazor/json"
      },
      "pypi": {
        "detail": "latest=1.1.0 local=1.2.0",
        "ok": false,
        "status": "mismatch",
        "url": "https://pypi.org/pypi/tracerazor/json"
      },
      "schemas": {
        "detail": "19 schemas",
        "ok": true,
        "status": "available"
      }
    },
    "local_version": "1.2.0",
    "offline": false,
    "package": "tracerazor",
    "platform": "Linux-6.18.44-fc-v37-x86_64-with-glibc2.39",
    "python": "3.11.15",
    "schema_version": "trice-doctor/v1",
    "summary": {
      "failed": [
        "pypi",
        "crates_io",
        "github_tag"
      ],
      "ok": false,
      "unknown": [
        "piwheels",
        "openssf_scorecard"
      ]
    }
  },
  "doctor_snapshot_sha256": "68655ee8cfdd3dca8dcd432f55888d60c7beedf7cc984d6ffc8074dcaf1b9d5c",
  "inputs": {
    "artifact_card": {
      "bytes": 16185,
      "path": "docs/trice_artifact_card.json",
      "present": true,
      "sha256": "b35e4ad0fb2afc7d57f28f4b19e1b953acc65c4d1f5ef8fe66e9ba4ca494914a"
    },
    "contract_card": {
      "bytes": 19194,
      "path": "docs/trice_contract_card.json",
      "present": true,
      "sha256": "ced41a779dff9e8c3c17752a78fb505b09115d09a745e2c2db0293a12753d233"
    },
    "install_card": {
      "bytes": 13925,
      "path": "docs/trice_install_card.json",
      "present": true,
      "sha256": "a901c24a391d869c77362552666b10fbf3d048b7c10b20cce317d4397f038e45"
    },
    "public_trust_matrix": {
      "bytes": 11414,
      "path": "docs/public_trust_matrix.md",
      "present": true,
      "sha256": "42f28d2beae0f8c64da05de002c131d64ae7de9ecd3943d6d3acc4a513765ed0"
    },
    "pyproject": {
      "bytes": 7349,
      "path": "pyproject.toml",
      "present": true,
      "sha256": "37c5096fd853b81bd2589f5a6216bdba17d8bc22e77f7ef47542bcb5c7f33805"
    },
    "readme": {
      "bytes": 20348,
      "path": "README.md",
      "present": true,
      "sha256": "5ac3568a3ecc4dfcd38f4944882d1137e42b667c3517c3d9b5ebe57430f43741"
    },
    "release_checklist": {
      "bytes": 8855,
      "path": "docs/release_checklist.md",
      "present": true,
      "sha256": "02c4135f9c44c5efeb99c9cc31222255f04637ef74f8b5a78d015489c894d120"
    },
    "reproduction_card": {
      "bytes": 7294,
      "path": "docs/trice_reproduction_card.json",
      "present": true,
      "sha256": "74ec65592fa039648a1b78fd73f133b6abf8a528ceb848fab35416ca02436cfa"
    }
  },
  "next_actions": [
    "Publish 1.2.0 to PyPI only after local release gates pass.",
    "Informational only for 1.1: do not add an sdist solely for piwheels.",
    "Optional: publish Rust crates only after declaring a stable public Rust API; keep cargo-install claims out of the README meanwhile.",
    "Create and push the v1.2.0 tag only after local gates pass.",
    "Run and publish OpenSSF Scorecard until the public score is at least 7.0."
  ],
  "package": {
    "local_version": "1.2.0",
    "name": "tracerazor",
    "offline": false,
    "platform": "Linux-6.18.44-fc-v37-x86_64-with-glibc2.39",
    "python": "3.11.15"
  },
  "public_release_ready": false,
  "release_card_sha256": "be8efcbedd1af3813c0083a991a072672be398f9dcdef64e6d18e92bc1ea1eb3",
  "release_level": "local_release_candidate",
  "release_score": 80,
  "research_basis": [
    "SLSA frames provenance as a release property: consumers need to know what built an artifact, how, and from which inputs.",
    "OpenSSF Scorecard treats public project health as a set of automated checks rather than maintainer promises.",